{"kind":"analytics-spine-pack-signature","schemaVersion":1,"manifestDigest":"sha256:0000000000000000000000000000000000000000000000000000000000000000","signedAt":"2026-01-01T00:00:00Z","proof":{"algorithm":"Ed25519","keyId":"sha256:0000000000000000000000000000000000000000000000000000000000000000","proofBytes":"AAAAAAAAAAAAAAAAAAAAAAAAAAAAAAAAAAAAAAAAAAAAAAAAAAAAAAAAAAAAAAAAAAAAAAAAAAAAAAAAAAAAAA=="}}
